{
  "schema_version": "v1",
  "generated_at": "2026-04-27T00:48:44.357Z",
  "source": "passive-quality-feedback",
  "latest_gate": {
    "gate_id": "ai-dev-quality-gate",
    "passed": true,
    "generated_at": "2026-04-27T00:48:44.357Z",
    "artifact_path": ".spec-first/workflows/quality-gates/ai-dev-quality-gate/ai-dev-quality-gate-result.json"
  },
  "candidate_topics": []
}
